{
	"id": "enaml.studio.core.ui",
	"name": "Studio Core UI",
	"description": "The core Enaml Studio UI plugin.",
	"class": "enaml.studio.core_ui_plugin.CoreUIPlugin",
	"extension_points": [
		{
			"id": "title",
			"name": "Studio UI Title",
			"description": "The extension point for the main window title."
		},
		{
			"id": "menubar",
			"name": "Studio UI Menu Bar",
			"description": "The extension point for the main window menu bar."
		},
		{
			"id": "content",
			"name": "Studio UI Central Content",
			"description": "The extension point for main window central widget."
		}
	]
}
